Superman,1978,7.4,https://m.media-amazon.com/images/M/MV5BMzA0YWMwMTUtMTVhNC00NjRkLWE2ZTgtOWEzNjJhYzNiMTlkXkEyXkFqcGdeQXVyNjc1NTYyMjg@._V1_SX300.jpg,"An alien orphan is sent from his dying planet to Earth, where he grows up to become his adoptive home's first and greatest superhero.",tt0078346
Titanic,1997,7.9,https://m.media-amazon.com/images/M/MV5BMDdmZGU3NDQtY2E5My00ZTliLWIzOTUtMTY4ZGI1YjdiNjk3XkEyXkFqcGdeQXVyNTA4NzY1MzY@._V1_SX300.jpg,"A seventeen-year-old aristocrat falls in love with a kind but poor artist aboard the luxurious, ill-fated R.M.S. Titanic.",tt0120338
Titanic,1996,5.8,https://m.media-amazon.com/images/M/MV5BMTBhMjUzMDItYTBlZS00OThkLWJmZDQtMjg1YTQ5ZDkxYmFjXkEyXkFqcGdeQXVyNjk1Njg5NTA@._V1_SX300.jpg,"The story of the 1912 sinking of the largest luxury liner ever built, the tragedy that befell over two thousand of the rich and famous as well as of the poor and unknown passengers aboard the doomed ship.",tt0115392
Titanic,2012,1.0,https://m.media-amazon.com/images/M/MV5BMTA4MjIyZWEtZjYwMS00ZmQ1LWJiMDEtMWNiNTI5NWE3OGJjXkEyXkFqcGdeQXVyNjk1Njg5NTA@._V1_SX300.jpg,New plot,tt1869152
Indiana Jones and the Temple of Doom,1984,10.0,https://m.media-amazon.com/images/M/MV5BYzgzMTIzNzctNmNiZC00ZDYyLWJjNzktMmQ2MDM2ZDkwZGVhXkEyXkFqcGdeQXVyMjM4MzQ4OTQ@._V1_SX300.jpg,best movie ever!,tt0087469
Indiana Jones and the Temple of Doom,1985,5.5,https://m.media-amazon.com/images/M/MV5BZWZlMWY0NjgtODVlZS00ZTk2LTljZDktMDZiN2UyOGNmYTBjXkEyXkFqcGdeQXVyNjM2NTM3ODA@._V1_SX300.jpg,"Play as Indy and whips your way through the levels rescuing children from Mola Ram, jumping gaps using the whip and riding the mine carts, choosing the right track to avoid obstacles.",tt0481113
